{
  "schema_version": 1,
  "profile": "node",
  "check": { "commands": ["node {{devbaseline}} run-derived-check --dir ."] },
  "staging": { "required": true, "command": "node {{devbaseline}} verify --repo . --log .devbaseline-verify.json" },
  "autofix": { "enabled": true, "ref": "v1.7.4" },
  "context": { "entrypoints": ["package.json", "src/sum.js"] },
  "credentials": [{ "name": "LLM_LADDER_TOKEN", "kind": "org_secret" }],
  "logs": { "retention_days": 90 }
}
